{
    "schema_version": "vfx_prefab_graph.v1",
    "graph_id": "pfg_e807209a3dc351ae16d4",
    "source": {
        "source_kind": "generated",
        "prefab_path": "Assets/Generated/PromptAssetAwareSlashR002/slash/candidate_001/GeneratedRoot.prefab",
        "source_example_id": ""
    },
    "root_node_id": "n0000",
    "nodes": [
        {
            "node_id": "n0000",
            "name": "GeneratedRoot",
            "role": "root",
            "sibling_index": 0,
            "depth": 0,
            "parent_node_id": "",
            "hierarchy_path": "GeneratedRoot[0]",
            "active_self": true,
            "component_types": [
                "UnityEngine.Transform"
            ],
            "transform": {
                "local_position": [
                    0.0,
                    0.0,
                    0.0
                ],
                "local_rotation": [
                    0.0,
                    0.0,
                    0.0,
                    1.0
                ],
                "local_scale": [
                    1.0,
                    1.0,
                    1.0
                ]
            }
        },
        {
            "node_id": "n0001",
            "name": "GeneratedLayer_01",
            "role": "core",
            "sibling_index": 0,
            "depth": 1,
            "parent_node_id": "n0000",
            "hierarchy_path": "GeneratedRoot[0]/GeneratedLayer_01[0]",
            "active_self": true,
            "component_types": [
                "UnityEngine.ParticleSystem",
                "UnityEngine.ParticleSystemRenderer",
                "UnityEngine.Transform"
            ],
            "transform": {
                "local_position": [
                    0.0,
                    0.0,
                    0.0
                ],
                "local_rotation": [
                    0.0,
                    0.0,
                    0.0,
                    1.0
                ],
                "local_scale": [
                    1.0,
                    1.0,
                    1.0
                ]
            }
        }
    ],
    "components": {
        "particle_systems": [
            {
                "component_id": "p0000",
                "node_id": "n0001",
                "parameters": {
                    "duration_seconds": 0.7599999904632568,
                    "looping": false,
                    "simulation_space": "Local",
                    "max_particles": 64,
                    "start_lifetime_max": 0.5,
                    "start_speed_max": 1.0,
                    "start_size_max": 1.899999976158142,
                    "start_color_rgba": [
                        0.07999999821186066,
                        0.3499999940395355,
                        1.0,
                        0.949999988079071
                    ],
                    "end_color_rgba": [
                        0.02800000086426735,
                        0.12250000238418579,
                        1.0,
                        0.0
                    ],
                    "emission_enabled": true,
                    "emission_rate_over_time_max": 0.0,
                    "burst_particle_count": 9,
                    "shape_enabled": true,
                    "shape_type": "Circle",
                    "shape_radius": 0.0949999988079071,
                    "color_over_lifetime_enabled": true,
                    "size_over_lifetime_enabled": true,
                    "end_size_multiplier": 0.05000000074505806,
                    "renderer_mode": "Billboard",
                    "sorting_order": 2,
                    "texture_profile": "",
                    "shader_profile": "",
                    "material_template_path": "Assets/Hovl Studio/Toon Projectiles 2/Materials/Trail54bcg.mat",
                    "serialized_modules": "unity_api_readback"
                },
                "material_paths": [
                    "Assets/Generated/PromptAssetAwareSlashR002/slash/candidate_001/Materials/pfg_e807209a3dc351ae16d4_p0000.mat"
                ],
                "mesh_paths": []
            }
        ],
        "renderers": [
            {
                "component_id": "r0000",
                "node_id": "n0001",
                "renderer_type": "ParticleSystemRenderer",
                "enabled": true,
                "parameters": {
                    "particle_render_mode": "Billboard",
                    "sorting_order": 2
                },
                "material_paths": [
                    "Assets/Generated/PromptAssetAwareSlashR002/slash/candidate_001/Materials/pfg_e807209a3dc351ae16d4_p0000.mat"
                ],
                "mesh_paths": []
            }
        ],
        "animations": []
    },
    "asset_bindings": {
        "materials": [
            "Assets/Generated/PromptAssetAwareSlashR002/slash/candidate_001/Materials/pfg_e807209a3dc351ae16d4_p0000.mat"
        ],
        "meshes": []
    },
    "reconstruction": {
        "status": "reconstructable",
        "compiler_profile": "particle_v1",
        "missing_fields": [],
        "unsupported_components": []
    },
    "training": {
        "eligible_tasks": [
            "component_prediction",
            "full_reconstruction",
            "hierarchy_modeling",
            "particle_parameter_modeling"
        ],
        "excluded_tasks": [
            "aesthetic_preference",
            "prompt_condition"
        ],
        "aesthetic_label_source": "ai_hypothesis"
    },
    "provenance": {
        "source_dataset_id": "prompt_condition_generation",
        "source_run_id": "",
        "exporter": "prefab_graph_readback.v1",
        "assumptions": [
            "Graph exported through Unity AssetDatabase and component APIs.",
            "Material and mesh paths point to the compiled Prefab output assets."
        ]
    }
}
