{
  "asset_bindings": {
    "materials": [
      "Assets/VFXSourceIngest/Trains/Trains_FX_All_001/ArtResources/Effect/__Materials/Mat_55_Glow_03.mat"
    ],
    "meshes": []
  },
  "components": {
    "animations": [],
    "particle_systems": [
      {
        "component_id": "p0000",
        "material_paths": [
          "Assets/VFXSourceIngest/Trains/Trains_FX_All_001/ArtResources/Effect/__Materials/Mat_55_Glow_03.mat"
        ],
        "mesh_paths": [],
        "node_id": "n0001",
        "parameters": {
          "burst_particle_count": 8,
          "color_over_lifetime_enabled": true,
          "duration_seconds": 0.8,
          "emission_enabled": true,
          "emission_rate_over_time_max": 0.0,
          "end_color_rgba": [
            0.027999999999999997,
            0.12249999999999998,
            1.0,
            0.0
          ],
          "end_size_multiplier": 0.05,
          "looping": false,
          "material_paths": [],
          "material_template_path": "Assets/VFXSourceIngest/Trains/Trains_FX_All_001/ArtResources/Effect/__Materials/Mat_55_Glow_03.mat",
          "max_particles": 64,
          "renderer_mode": "Billboard",
          "serialized_modules": {
            "condition_family": "lightning",
            "condition_style": "realistic",
            "profile": "prompt_condition_particle_v1"
          },
          "shape_enabled": true,
          "shape_radius": 0.1,
          "shape_type": "Sphere",
          "simulation_space": "Local",
          "size_over_lifetime_enabled": true,
          "sorting_order": 2,
          "start_color_rgba": [
            0.08,
            0.35,
            1.0,
            0.95
          ],
          "start_lifetime_max": 0.5,
          "start_size_max": 1.0,
          "start_speed_max": 1.0,
          "texture_profile": "Assets/VFXSourceIngest/Shared/Textures/da/Tex_23_glow_05_dafa6ab29e839e5d.png"
        }
      }
    ],
    "renderers": [
      {
        "component_id": "r0000",
        "enabled": true,
        "material_paths": [
          "Assets/VFXSourceIngest/Trains/Trains_FX_All_001/ArtResources/Effect/__Materials/Mat_55_Glow_03.mat"
        ],
        "mesh_paths": [],
        "node_id": "n0001",
        "parameters": {
          "particle_render_mode": "Billboard",
          "sorting_order": 2
        },
        "renderer_type": "ParticleSystemRenderer"
      }
    ]
  },
  "condition": {
    "effect_family": "lightning",
    "parent_prefab_path": null,
    "prompt": "写实蓝色雷电，快速爆发，标准性能，不要长拖尾",
    "seed": 20260907,
    "style_family": "realistic"
  },
  "graph_id": "pfg_ba901ce634888cf1f0d2",
  "nodes": [
    {
      "active_self": true,
      "component_types": [
        "UnityEngine.Transform"
      ],
      "depth": 0,
      "hierarchy_path": "GeneratedRoot[0]",
      "name": "GeneratedRoot",
      "node_id": "n0000",
      "parent_node_id": null,
      "role": "root",
      "sibling_index": 0,
      "transform": {
        "local_position": [
          0.0,
          0.0,
          0.0
        ],
        "local_rotation": [
          0.0,
          0.0,
          0.0,
          1.0
        ],
        "local_scale": [
          1.0,
          1.0,
          1.0
        ]
      }
    },
    {
      "active_self": true,
      "component_types": [
        "UnityEngine.ParticleSystem",
        "UnityEngine.ParticleSystemRenderer",
        "UnityEngine.Transform"
      ],
      "depth": 1,
      "hierarchy_path": "GeneratedRoot[0]/GeneratedLayer_01[0]",
      "name": "GeneratedLayer_01",
      "node_id": "n0001",
      "parent_node_id": "n0000",
      "role": "core",
      "sibling_index": 0,
      "transform": {
        "local_position": [
          0.0,
          0.0,
          0.0
        ],
        "local_rotation": [
          0.0,
          0.0,
          0.0,
          1.0
        ],
        "local_scale": [
          1.0,
          1.0,
          1.0
        ]
      }
    }
  ],
  "provenance": {
    "assumptions": [
      "Constrained decoder emits a structure-only graph with safe default particle parameters.",
      "No source or parent Prefab is read."
    ],
    "exporter": "prefab_graph_constrained.v1",
    "source_dataset_id": "prompt_condition_generation",
    "source_run_id": null
  },
  "reconstruction": {
    "compiler_profile": "particle_v1",
    "missing_fields": [],
    "status": "reconstructable",
    "unsupported_components": []
  },
  "root_node_id": "n0000",
  "schema_version": "vfx_prefab_graph.v1",
  "source": {
    "prefab_path": null,
    "source_example_id": null,
    "source_kind": "generated"
  },
  "training": {
    "aesthetic_label_source": "ai_hypothesis",
    "eligible_tasks": [
      "component_prediction",
      "full_reconstruction",
      "hierarchy_modeling",
      "particle_parameter_modeling"
    ],
    "excluded_tasks": [
      "aesthetic_preference",
      "prompt_condition"
    ]
  }
}
