{
    "schema_version": "vfx_prefab_graph.v1",
    "graph_id": "pfg_2214f3cb743c116abc7d",
    "source": {
        "source_kind": "unity_audit",
        "prefab_path": "Assets/Generated/TutorialLightningFixedColorR002/tutorial_blend_control/GeneratedRoot.prefab",
        "source_example_id": "tutorial_blend_control"
    },
    "root_node_id": "n0000",
    "nodes": [
        {
            "node_id": "n0000",
            "name": "GeneratedRoot",
            "role": "root",
            "sibling_index": 0,
            "depth": 0,
            "parent_node_id": "",
            "hierarchy_path": "GeneratedRoot[0]",
            "active_self": true,
            "component_types": [
                "UnityEngine.Transform"
            ],
            "transform": {
                "local_position": [
                    0.0,
                    0.0,
                    0.0
                ],
                "local_rotation": [
                    0.0,
                    0.0,
                    0.0,
                    1.0
                ],
                "local_scale": [
                    1.0,
                    1.0,
                    1.0
                ]
            }
        },
        {
            "node_id": "n0001",
            "name": "MainBolt",
            "role": "core",
            "sibling_index": 0,
            "depth": 1,
            "parent_node_id": "n0000",
            "hierarchy_path": "GeneratedRoot[0]/MainBolt[0]",
            "active_self": true,
            "component_types": [
                "UnityEngine.ParticleSystem",
                "UnityEngine.ParticleSystemRenderer",
                "UnityEngine.Transform"
            ],
            "transform": {
                "local_position": [
                    0.0,
                    0.0,
                    0.0
                ],
                "local_rotation": [
                    0.0,
                    0.0,
                    0.0,
                    1.0
                ],
                "local_scale": [
                    1.0,
                    1.0,
                    1.0
                ]
            }
        }
    ],
    "components": {
        "particle_systems": [
            {
                "component_id": "p0000",
                "node_id": "n0001",
                "parameters": {
                    "color_over_lifetime_gradient": {
                        "mode": "Blend",
                        "color_keys": [
                            {
                                "time": 0.0,
                                "rgb": [
                                    1.0,
                                    1.0,
                                    1.0
                                ]
                            },
                            {
                                "time": 0.17999541759490968,
                                "rgb": [
                                    0.0,
                                    0.0,
                                    0.0
                                ]
                            },
                            {
                                "time": 0.3199969530105591,
                                "rgb": [
                                    1.0,
                                    1.0,
                                    1.0
                                ]
                            },
                            {
                                "time": 0.5600060820579529,
                                "rgb": [
                                    0.11999999731779099,
                                    0.11999999731779099,
                                    0.11999999731779099
                                ]
                            },
                            {
                                "time": 0.7199969291687012,
                                "rgb": [
                                    1.0,
                                    1.0,
                                    1.0
                                ]
                            },
                            {
                                "time": 1.0,
                                "rgb": [
                                    1.0,
                                    1.0,
                                    1.0
                                ]
                            }
                        ],
                        "alpha_keys": [
                            {
                                "time": 0.0,
                                "alpha": 1.0
                            },
                            {
                                "time": 1.0,
                                "alpha": 1.0
                            }
                        ]
                    },
                    "material_color_mode": "preserve_template",
                    "duration_seconds": 0.5357142686843872,
                    "start_delay_max": 0.0,
                    "looping": false,
                    "simulation_space": "Local",
                    "max_particles": 16,
                    "start_lifetime_max": 0.30000001192092898,
                    "start_speed_max": 0.0,
                    "start_size_max": 4.800000190734863,
                    "start_size_3d": true,
                    "start_size_x_max": 4.800000190734863,
                    "start_size_y_max": 0.75,
                    "start_size_z_max": 1.0,
                    "start_rotation_max": 1.5707963705062867,
                    "gravity_modifier_max": 0.0,
                    "start_color_rgba": [
                        0.7129999995231628,
                        0.824999988079071,
                        1.0,
                        1.0
                    ],
                    "end_color_rgba": [
                        1.0,
                        1.0,
                        1.0,
                        1.0
                    ],
                    "emission_enabled": true,
                    "emission_rate_over_time_max": 0.0,
                    "burst_particle_count": 1,
                    "shape_enabled": false,
                    "shape_type": "disabled",
                    "shape_radius": 1.0,
                    "color_over_lifetime_enabled": true,
                    "size_over_lifetime_enabled": true,
                    "end_size_multiplier": 1.0,
                    "renderer_mode": "Billboard",
                    "sorting_order": 12,
                    "texture_profile": "",
                    "shader_profile": "",
                    "material_template_path": "",
                    "serialized_modules": {
                        "emission": true,
                        "shape": false,
                        "color_over_lifetime": true,
                        "size_over_lifetime": true,
                        "rotation_over_lifetime": false,
                        "texture_sheet_animation": false,
                        "velocity_over_lifetime": false,
                        "custom_data": false
                    }
                },
                "material_paths": [
                    "Assets/Generated/TutorialLightningFixedColorR002/tutorial_blend_control/Materials/pfg_86c7b33f82d538b1f3e7_p0000.mat"
                ],
                "mesh_paths": []
            }
        ],
        "renderers": [
            {
                "component_id": "r0000",
                "node_id": "n0001",
                "renderer_type": "ParticleSystemRenderer",
                "enabled": true,
                "parameters": {
                    "particle_render_mode": "Billboard",
                    "sorting_order": 12,
                    "active_vertex_streams": [
                        "Position",
                        "Color",
                        "UV"
                    ]
                },
                "material_paths": [
                    "Assets/Generated/TutorialLightningFixedColorR002/tutorial_blend_control/Materials/pfg_86c7b33f82d538b1f3e7_p0000.mat"
                ],
                "mesh_paths": []
            }
        ],
        "animations": []
    },
    "asset_bindings": {
        "materials": [
            "Assets/Generated/TutorialLightningFixedColorR002/tutorial_blend_control/Materials/pfg_86c7b33f82d538b1f3e7_p0000.mat"
        ],
        "meshes": []
    },
    "reconstruction": {
        "status": "reconstructable",
        "compiler_profile": "particle_v1",
        "missing_fields": [],
        "unsupported_components": []
    },
    "training": {
        "eligible_tasks": [
            "component_prediction",
            "full_reconstruction",
            "hierarchy_modeling",
            "particle_parameter_modeling"
        ],
        "excluded_tasks": [
            "aesthetic_preference",
            "prompt_condition"
        ],
        "aesthetic_label_source": "none"
    },
    "provenance": {
        "source_dataset_id": "generated_color_fidelity_probes_not_external_training_sources",
        "source_run_id": "",
        "exporter": "prefab_graph_source_unity.v1",
        "assumptions": [
            "All values were read through Unity AssetDatabase and component APIs.",
            "Source labels and directories are not aesthetic supervision.",
            "Unsupported or missing runtime context is retained as an explicit reconstruction limitation."
        ]
    }
}
