{
  "asset_bindings": {
    "materials": [],
    "meshes": []
  },
  "components": {
    "animations": [],
    "particle_systems": [
      {
        "component_id": "p0000",
        "material_paths": [],
        "mesh_paths": [],
        "node_id": "n0001",
        "parameters": {
          "burst_particle_count": 72,
          "color_over_lifetime_enabled": true,
          "duration_seconds": 0.8,
          "emission_enabled": true,
          "emission_rate_over_time_max": 0.0,
          "end_color_rgba": [
            0.05,
            0.35,
            1.0,
            0.0
          ],
          "end_size_multiplier": 0.05,
          "looping": false,
          "material_template_path": "Assets/VFXSourceIngest/Trains/Trains_FX_All_001/ArtResources/FX/juese/FX_S_fozu/mat/Mat_fozu_03.mat",
          "max_particles": 144,
          "renderer_mode": "Billboard",
          "serialized_modules": {
            "profile": "generated_particle_v1"
          },
          "shape_enabled": true,
          "shape_radius": 0.08,
          "shape_type": "Sphere",
          "simulation_space": "Local",
          "size_over_lifetime_enabled": true,
          "sorting_order": 3,
          "start_color_rgba": [
            0.55,
            0.9,
            1.0,
            0.9832290349712195
          ],
          "start_lifetime_max": 0.44,
          "start_size_max": 4.8,
          "start_speed_max": 0.5,
          "texture_profile": "soft_disc"
        }
      },
      {
        "component_id": "p0001",
        "material_paths": [],
        "mesh_paths": [],
        "node_id": "n0002",
        "parameters": {
          "burst_particle_count": 112,
          "color_over_lifetime_enabled": true,
          "duration_seconds": 0.8,
          "emission_enabled": true,
          "emission_rate_over_time_max": 0.0,
          "end_color_rgba": [
            0.02,
            0.08,
            0.35,
            0.0
          ],
          "end_size_multiplier": 0.05,
          "looping": false,
          "material_template_path": "Assets/VFXSourceIngest/Trains/Trains_FX_All_001/ArtResources/FX/juese/FX_S_fozu/mat/Mat_fozu_03.mat",
          "max_particles": 224,
          "renderer_mode": "Billboard",
          "serialized_modules": {
            "profile": "generated_particle_v1"
          },
          "shape_enabled": true,
          "shape_radius": 0.28,
          "shape_type": "Sphere",
          "simulation_space": "Local",
          "size_over_lifetime_enabled": true,
          "sorting_order": 2,
          "start_color_rgba": [
            0.05,
            0.42,
            1.0,
            0.72
          ],
          "start_lifetime_max": 0.7,
          "start_size_max": 2.1,
          "start_speed_max": 2.4,
          "texture_profile": "soft_disc"
        }
      },
      {
        "component_id": "p0002",
        "material_paths": [],
        "mesh_paths": [],
        "node_id": "n0003",
        "parameters": {
          "burst_particle_count": 160,
          "color_over_lifetime_enabled": true,
          "duration_seconds": 0.8,
          "emission_enabled": true,
          "emission_rate_over_time_max": 0.0,
          "end_color_rgba": [
            0.1,
            0.45,
            1.0,
            0.0
          ],
          "end_size_multiplier": 0.05,
          "looping": false,
          "material_template_path": "Assets/VFXSourceIngest/Trains/Trains_FX_All_001/ArtResources/FX/juese/FX_S_fozu/mat/Mat_fozu_03.mat",
          "max_particles": 320,
          "renderer_mode": "Billboard",
          "serialized_modules": {
            "profile": "generated_particle_v1"
          },
          "shape_enabled": true,
          "shape_radius": 0.2,
          "shape_type": "Sphere",
          "simulation_space": "Local",
          "size_over_lifetime_enabled": true,
          "sorting_order": 4,
          "start_color_rgba": [
            0.72,
            0.95,
            1.0,
            0.92
          ],
          "start_lifetime_max": 0.78,
          "start_size_max": 0.24,
          "start_speed_max": 5.0,
          "texture_profile": "spark"
        }
      }
    ],
    "renderers": [
      {
        "component_id": "r0000",
        "enabled": true,
        "material_paths": [],
        "mesh_paths": [],
        "node_id": "n0001",
        "parameters": {
          "particle_render_mode": "Billboard",
          "sorting_order": 3
        },
        "renderer_type": "ParticleSystemRenderer"
      },
      {
        "component_id": "r0001",
        "enabled": true,
        "material_paths": [],
        "mesh_paths": [],
        "node_id": "n0002",
        "parameters": {
          "particle_render_mode": "Billboard",
          "sorting_order": 2
        },
        "renderer_type": "ParticleSystemRenderer"
      },
      {
        "component_id": "r0002",
        "enabled": true,
        "material_paths": [],
        "mesh_paths": [],
        "node_id": "n0003",
        "parameters": {
          "particle_render_mode": "Billboard",
          "sorting_order": 4
        },
        "renderer_type": "ParticleSystemRenderer"
      }
    ]
  },
  "condition": {
    "effect_family": "explosion",
    "parent_prefab_path": null,
    "prompt": "卡通蓝色能量冲击，快速爆发，不要长拖尾",
    "seed": 20262002,
    "style_family": "cartoon"
  },
  "graph_id": "pfg_779fbf3b883ce0a99959",
  "nodes": [
    {
      "active_self": true,
      "component_types": [
        "UnityEngine.Transform"
      ],
      "depth": 0,
      "hierarchy_path": "GeneratedBlueImpact[0]",
      "name": "GeneratedBlueImpact",
      "node_id": "n0000",
      "parent_node_id": null,
      "role": "root",
      "sibling_index": 0,
      "transform": {
        "local_position": [
          0.0,
          0.0,
          0.0
        ],
        "local_rotation": [
          0.0,
          0.0,
          0.0,
          1.0
        ],
        "local_scale": [
          1.0,
          1.0,
          1.0
        ]
      }
    },
    {
      "active_self": true,
      "component_types": [
        "UnityEngine.ParticleSystem",
        "UnityEngine.ParticleSystemRenderer",
        "UnityEngine.Transform"
      ],
      "depth": 1,
      "hierarchy_path": "GeneratedBlueImpact[0]/Core[0]",
      "name": "Core",
      "node_id": "n0001",
      "parent_node_id": "n0000",
      "role": "core",
      "sibling_index": 0,
      "transform": {
        "local_position": [
          0.0,
          0.0,
          0.0
        ],
        "local_rotation": [
          0.0,
          0.0,
          0.0,
          1.0
        ],
        "local_scale": [
          1.0,
          1.0,
          1.0
        ]
      }
    },
    {
      "active_self": true,
      "component_types": [
        "UnityEngine.ParticleSystem",
        "UnityEngine.ParticleSystemRenderer",
        "UnityEngine.Transform"
      ],
      "depth": 1,
      "hierarchy_path": "GeneratedBlueImpact[0]/Support[1]",
      "name": "Support",
      "node_id": "n0002",
      "parent_node_id": "n0000",
      "role": "support",
      "sibling_index": 1,
      "transform": {
        "local_position": [
          0.0,
          0.0,
          0.0
        ],
        "local_rotation": [
          0.0,
          0.0,
          0.0,
          1.0
        ],
        "local_scale": [
          1.0,
          1.0,
          1.0
        ]
      }
    },
    {
      "active_self": true,
      "component_types": [
        "UnityEngine.ParticleSystem",
        "UnityEngine.ParticleSystemRenderer",
        "UnityEngine.Transform"
      ],
      "depth": 1,
      "hierarchy_path": "GeneratedBlueImpact[0]/Sparks[2]",
      "name": "Sparks",
      "node_id": "n0003",
      "parent_node_id": "n0000",
      "role": "hit",
      "sibling_index": 2,
      "transform": {
        "local_position": [
          0.0,
          0.0,
          0.0
        ],
        "local_rotation": [
          0.0,
          0.0,
          0.0,
          1.0
        ],
        "local_scale": [
          1.0,
          1.0,
          1.0
        ]
      }
    }
  ],
  "provenance": {
    "assumptions": [
      "Seed profile template_glow_r005 is an AI hypothesis for compiler validation.",
      "No source or parent Prefab is read by this seed."
    ],
    "exporter": "prefab_graph.v1",
    "source_dataset_id": "generated_seed",
    "source_run_id": null
  },
  "reconstruction": {
    "compiler_profile": "particle_v1",
    "missing_fields": [],
    "status": "reconstructable",
    "unsupported_components": []
  },
  "root_node_id": "n0000",
  "schema_version": "vfx_prefab_graph.v1",
  "source": {
    "prefab_path": null,
    "source_example_id": null,
    "source_kind": "generated"
  },
  "training": {
    "aesthetic_label_source": "ai_hypothesis",
    "eligible_tasks": [
      "component_prediction",
      "full_reconstruction",
      "hierarchy_modeling",
      "particle_parameter_modeling"
    ],
    "excluded_tasks": [
      "aesthetic_preference",
      "prompt_condition"
    ]
  }
}
